{
  "schema_version": "2.0.0",
  "artifact_type": "realistic_v4_story_breakdown",
  "lineage": {
    "packet_id": "SP-REALISTIC-PB-MT-SN-CLAR-V4",
    "run_id": "RUN-REALISTIC-MULTI-SOURCE-V4",
    "parent_trace_id": "26c7466f817aa1511f4a4e239bb52a62",
    "approval_execution_id": 9724,
    "approval_trace_id": "f4e298e120d6503b5dfac4688adae1db",
    "prd_execution_id": 9725,
    "prd_trace_id": "f8879ebe22d888152a77f892230c62ba"
  },
  "epics": [
    {
      "id": "EPIC-001",
      "title": "Dashboard Experience",
      "description": "Deliver the approved fixed-layout single-page dashboard with responsive web access at launch and approved page-load performance.",
      "source_refs": [
        "FR-001",
        "NFR-002",
        "DEC-2026-08-07-GAP-001",
        "DEC-2026-08-07-GAP-003",
        "DEC-2026-08-07-GAP-014-A1",
        "DEC-2026-08-07-MOBILE-LAUNCH-001"
      ],
      "features": [
        {
          "id": "FEAT-001",
          "title": "Responsive Single-Page Dashboard",
          "description": "Provide the approved fixed-layout SPA and responsive web access for the first production release.",
          "source_refs": [
            "FR-001",
            "CON-009",
            "CON-010",
            "CON-011",
            "DDL-001",
            "DEC-2026-08-07-GAP-001",
            "DEC-2026-08-07-GAP-014-A1",
            "DEC-2026-08-07-MOBILE-LAUNCH-001"
          ],
          "stories": [
            {
              "id": "US-001",
              "title": "Use the approved dashboard experience",
              "story": "As a business user, I want a fixed-layout single-page analytics dashboard so that I can access dashboard reporting without requiring SQL or help from the data team.",
              "priority": "Must Have",
              "acceptance_criteria": [
                {
                  "id": "SBAC-001",
                  "criterion": "The dashboard uses a fixed layout.",
                  "source_refs": [
                    "DEC-2026-08-07-GAP-001"
                  ]
                },
                {
                  "id": "SBAC-002",
                  "criterion": "The dashboard is implemented as a single-page application.",
                  "source_refs": [
                    "DEC-2026-08-07-GAP-014-A1"
                  ]
                }
              ],
              "source_refs": [
                "FR-001",
                "CON-009",
                "CON-010",
                "DEC-2026-08-07-GAP-001",
                "DEC-2026-08-07-GAP-014-A1"
              ]
            },
            {
              "id": "US-002",
              "title": "Access the dashboard responsively at launch",
              "story": "As a business user, I want responsive web access so that I can use the first production release through responsive web access.",
              "priority": "Must Have",
              "acceptance_criteria": [
                {
                  "id": "SBAC-003",
                  "criterion": "Responsive web access is completed before the 2026-09-30 production launch.",
                  "source_refs": [
                    "FR-001",
                    "DDL-001",
                    "DEC-2026-08-07-MOBILE-LAUNCH-001"
                  ]
                }
              ],
              "source_refs": [
                "FR-001",
                "CON-011",
                "DDL-001",
                "DEC-2026-08-07-MOBILE-LAUNCH-001"
              ]
            },
            {
              "id": "US-003",
              "title": "Load dashboard pages within the approved limit",
              "story": "As a business user, I want dashboard pages to load in under 3 seconds so that I can access dashboard reporting within the approved page-load limit.",
              "priority": "Must Have",
              "acceptance_criteria": [
                {
                  "id": "SBAC-004",
                  "criterion": "Dashboard pages load in under 3 seconds.",
                  "source_refs": [
                    "NFR-002",
                    "DEC-2026-08-07-GAP-003"
                  ]
                }
              ],
              "source_refs": [
                "NFR-002",
                "DEC-2026-08-07-GAP-003"
              ]
            }
          ]
        }
      ]
    },
    {
      "id": "EPIC-002",
      "title": "Warehouse-Backed Reporting",
      "description": "Provide approved reporting from precomputed warehouse data with controlled refresh and filtering performance.",
      "source_refs": [
        "FR-004",
        "FR-007",
        "FR-009",
        "FR-010",
        "NFR-002",
        "CON-003",
        "DEP-001",
        "DEP-002",
        "RSK-001",
        "DEC-2026-08-07-GAP-003",
        "DEC-2026-08-07-GAP-004",
        "DEC-2026-08-07-GAP-007"
      ],
      "features": [
        {
          "id": "FEAT-002",
          "title": "Controlled Data Refresh",
          "description": "Use the approved precomputed warehouse and hybrid refresh behavior without direct live-database queries.",
          "source_refs": [
            "FR-004",
            "FR-009",
            "FR-010",
            "CON-003",
            "DEP-001",
            "DEP-002",
            "RSK-001",
            "DEC-2026-08-07-GAP-004",
            "DEC-2026-08-07-GAP-007"
          ],
          "stories": [
            {
              "id": "US-004",
              "title": "Receive refreshed warehouse reporting data",
              "story": "As a business user, I want reporting data to refresh automatically every 15 minutes so that I can view the latest available precomputed warehouse data.",
              "priority": "Must Have",
              "acceptance_criteria": [
                {
                  "id": "SBAC-005",
                  "criterion": "Dashboard reporting uses precomputed warehouse data.",
                  "source_refs": [
                    "FR-004",
                    "DEP-001",
                    "DEC-2026-08-07-GAP-004"
                  ]
                },
                {
                  "id": "SBAC-006",
                  "criterion": "Automatic refresh runs every 15 minutes.",
                  "source_refs": [
                    "FR-004",
                    "DEC-2026-08-07-GAP-007"
                  ]
                }
              ],
              "source_refs": [
                "FR-004",
                "FR-009",
                "DEP-001",
                "DEC-2026-08-07-GAP-004",
                "DEC-2026-08-07-GAP-007"
              ]
            },
            {
              "id": "US-005",
              "title": "Refresh the latest available data manually",
              "story": "As a business user, I want to manually refresh the latest available precomputed warehouse data so that I can see its last-updated timestamp.",
              "priority": "Must Have",
              "acceptance_criteria": [
                {
                  "id": "SBAC-007",
                  "criterion": "Manual refresh returns the latest available precomputed warehouse data and shows a last-updated timestamp.",
                  "source_refs": [
                    "FR-004",
                    "DEC-2026-08-07-GAP-007"
                  ]
                },
                {
                  "id": "SBAC-008",
                  "criterion": "Refresh protects against excessive repeated requests and does not query the live database directly.",
                  "source_refs": [
                    "FR-004",
                    "FR-010",
                    "CON-003",
                    "RSK-001",
                    "DEC-2026-08-07-GAP-007"
                  ]
                }
              ],
              "source_refs": [
                "FR-004",
                "FR-010",
                "CON-003",
                "DEP-001",
                "DEP-002",
                "RSK-001",
                "DEC-2026-08-07-GAP-007"
              ]
            }
          ]
        },
        {
          "id": "FEAT-003",
          "title": "Report Filtering",
          "description": "Filter reporting by the approved fields using precomputed warehouse data within the approved response limit.",
          "source_refs": [
            "FR-007",
            "NFR-002",
            "DEP-001",
            "DEP-002",
            "DEC-2026-08-07-GAP-003",
            "DEC-2026-08-07-GAP-004"
          ],
          "stories": [
            {
              "id": "US-006",
              "title": "Filter reports",
              "story": "As a business user, I want to filter reports by date range, category, and status so that I can access the approved filtered reporting.",
              "priority": "Must Have",
              "acceptance_criteria": [
                {
                  "id": "SBAC-009",
                  "criterion": "Reports can be filtered by date range, category, and status using precomputed warehouse data.",
                  "source_refs": [
                    "FR-007",
                    "DEP-001",
                    "DEC-2026-08-07-GAP-004"
                  ]
                },
                {
                  "id": "SBAC-010",
                  "criterion": "Report filtering completes in under 2 seconds.",
                  "source_refs": [
                    "NFR-002"
                  ]
                }
              ],
              "source_refs": [
                "FR-007",
                "NFR-002",
                "DEP-001",
                "DEP-002",
                "DEC-2026-08-07-GAP-003",
                "DEC-2026-08-07-GAP-004"
              ]
            }
          ]
        }
      ]
    },
    {
      "id": "EPIC-003",
      "title": "Excel Export",
      "description": "Provide the approved XLSX export with formula preservation and the approved user-facing label.",
      "source_refs": [
        "FR-011",
        "AC-002",
        "CON-004",
        "DEC-2026-08-07-GAP-006"
      ],
      "features": [
        {